"respondentID","breakfast","calories_chicken","calories_day","calories_scone","coffee","cook","diet_current","diet_current_coded","drink","eating_changes","eating_changes_coded","eating_changes_coded1","eating_out","fruit_day","meals_dinner_friend","nutritional_check","parents_cook","pay_meal_out","tortilla_calories","turkey_calories","veggies_day","vitamins","waffle_calories"
"94","1","720","3","420","2","4","Very poor. Heavy carb consumption. ","2","2","I eat alot of carbs and eat much more frequently","1","2","2","4","Salmon, hamburger surprise, Italian potato soup","1","1","4","1165","690","5","2","1315"
"95","1","610","3","420","2","2","Complete diet. protein vegetables and carbs","1","2","I eat whatever is offered at egan or at the laker","1","3","2","5","salmon, steak, spaghetti squash","4","1","3","940","690","5","1","1315"
"96","1","265","2","420","2","3","I eat usually 2 times a day, either breakfast and dinner or lunch and dinner.  I feel that is enough for me.","2","2","Food is readily available so I don't have to cook so it's easier to eat a lot.","1","2","2","4","Pasta, fish, steak","3","1","3","1165","690","4","2","1315"
"97","1","430","3","420","2","2","Currently whatever Egan has at the moment.","2","2","I've eaten more fruits and vegetables. Started eating seafood.","2","5","2","3","Pizza, chicken, pasta","2","2","3","725","500","2","1","900"
"98","1","720","3","420","2","3","I try to maintain a healthy diet. I always try to eat foods that are beneficial to my health and that will impact me in the long run.","1","2","Coming to college I definitely have tried to change my eating habits in order to maintain my weight and be more healthy. ","2","5","2","5","Chicken Parm, Baked Ziti, Shrimp Alfredo ","4","1","5","1165","500","5","2","760"
"99","1","720","3","315","1","4","Somewhat unhealthy. This is due to my hectic work and school schedule.","2","2","When I was on campus (which I am not anymore) I ate way more fruits and vegetables since I had easy access to them.","2","5","5","5","Chicken parmigiana, pasta, wedding soup","3","3","6","1165","690","4","1","1315"
"100","1","430","4","420","1","4","i drink alot of lemon water, and milk. i also eat ice cream frequently after dinner. but i also eat lots of fruits and veggies","2","1","eat more salads","2","5","3","5","chicken alfredo, chicken parmesan, spaghetti","2","1","3","1165","690","5","1","900"
"101","1","610","3","420","2","3","I typically eat very healthy. i consume fruits and vegetables in about every meal. ","1","1","I consume a lot more grapefuit since I've come to college. The meals here are also more greasy than I am used to. ","1","3","2","5","spaghetti, steak, lasagna ","2","1","2","725","500","5","2","900"
"102","1","610","4","420","2","3","At this time it is very touch and go. Some days I live on sandwiches and ice cream while other days I eat lots of fruits and vegetables. ","2","2","I eat a lot more carbs than I did when I lived at home.","1","11","2","5","nan","4","1","2","1165","500","5","2","1315"
"103","1","610","4","420","2","2","A very healthy diet. Avoiding junk foods, and any white breads. ","1","2","Avoiding ""easy options"" such as junk foods ","2","5","3","5","nan","5","2","3","940","500","5","1","900"
"104","1","610","3","420","2","2","I have been eating mainly proteins and some fruits and vegetables every day with some less healthy snack foods.  ","1","1","Coming to college I have ate less well colored meals each day due to lack of income and desire to save money. I used to eat more fruits and vegetables, more chicken and salmon, now these habits have lightened up and are not as frequent and regular in the week. I have also started eating more bread and dairy products.","1","3","2","5","Spaghetti and pasta, seasoned salmon with steamed or boiled broccoli, or soup with ritz crackers if I was busy that day.","4","2","3","725","345","5","1","760"
"105","1","720","3","420","2","4","High in carbs, but I have recently tried to cut down on fats, salt, and sugars. I choose more organic options as well as more fruits and vegetables. ","2","2","I've definitely gotten used to eating more often since I have a fully cooked meal available to me at all the time.  Sometimes I would only eat one full meal and a snack in high school because I was so busy and did not have the time to cook. ","1","2","2","4","Pasta, Burgers and Fries, Chicken Marsala","4","2","4","940","690","5","1","1315"
"106","1","720","3","420","2","3","Since I am a college student I rarely cook full meals with protein, vegetables and starch. I usually just heat up leftovers from a restaurant or go eat casual food at the dining hall.","2","2","I do not eat full meals. Rarely eat 3 meals a day. ","1","10","3","3","Chicken rice and asparagus, pizza, something easy in the crockpot","2","1","5","1165","690","2","2","1315"
"107","1","430","3","315","2","2","It is pretty balanced with a diverse mixture of proteins, carbohydrates, vitamins and minerals. Fruits and chicken dominate my diet. ","1","1","I have been drinking more water. Since college, I've been more conscious about my diet and incorporated more fruits on my diet. ","2","12","5","5","Marinated nuts, prawn crackers, drink of their choice, mixed veggie crackers_x000D_Rice, chicken curry, lentil, pickle, potato kebab_x000D_Lemon Meringue Pie","4","1","3","580","500","5","2","760"
"108","1","430","3","420","1","2","I try to eat a balanced meal. I refrain from anything too fatty. ","1","1","My diet could improve now. I have been eating more than I should.","1","2","2","4","Pasta, Croque Madam, chicken ","2","1","3","1165","690","4","2","900"
"109","1","430","2","420","2","5","moderately health conscious ","1","2","Late night snacking","1","2","2","5","Steak, salmon, chicken parm","4","2","3","580","345","5","2","760"
"110","1","610","3","420","2","2","protein, carbs, less fruits and vegetables, some sweets ","2","2","I snack less and eat smaller portions ","2","5","3","4","Spaghetti, Grilled Chicken, Pizza ","4","2","3","940","690","3","1","1315"
"111","1","610","3","315","1","3","I eat at least 2 times a day at the universities dining places. I also sometimes cook myself and try to eat healthy a majority of the time. ","2","1","I eat out more. ","1","3","4","3","Grilled chicken, Spaghetti, Alfredo ","3","2","4","580","690","3","2","900"
"112","1","265","2","980","2","2","some healthy food and also some not so healthy.","1","2","more healthy food","2","5","2","3","nan","4","1","6","725","345","3","2","1315"
"113","1","610","4","315","2","1","I eat a lot of proteins and fruit and vegetables. I try to stay away from carbohydrates and sugary foods.","1","1","I had to change a lot. I keep track of calories and cut out most breads and wraps.","2","5","4","5","Dinner, Lunch, Dessert ","4","2","3","725","500","3","2","900"
"114","1","430","2","420","1","2","My current diet would be considered a ""college diet"". I eat a lot of pizza and ramen noodles. ","2","2","They have gotten very bad. I eat a lot more food that I know I should not eat. ","1","2","3","4","Beef Stroganoff, Chicken and Mashed Potatoes, Tacos ","4","2","3","1165","690","2","2","900"
"115","1","610","3","315","2","3","Not very healthy","2","2","not eating meals on time","1","10","3","4","Meat, meat and meat","3","1","5","940","850","3","2","760"
"116","1","610","4","980","2","4","I currently eat an abundance of carbohydrates. I have a low intake of protein. I overly intake calcium.","2","2","Eating more dairy due to more ice cream intake.","1","3","2","5","Pasta, Chicken, Pizza","1","1","5","1165","690","2","2","1315"
"117","1","610","3","420","2","3","It is very unbalance. Mostly fat food, Lack of vegetables.","2","1","less vegetable more sweats","1","3","4","5","Rice and Peas and Chicken, Jerk Chicken and Shrimp","2","2","3","725","345","5","1","1315"
"118","1","610","3","315","2","3","I eat in dining hall of school everyday. I usually have both meat and a little vegetable in every meal. ","1","1","I eat more vegetable. Since coming to college, I started to eat salads and tried to eat salads at least three times a week.","2","5","2","3","Vietnamese fried rolls, Pho, Some kinds of noodles.","2","1","2","725","690","3","1","760"
"119","1","430","3","420","1","3","Try to eat as healthy as possible. A few days where fast food comes into play because of classes. ","2","1","I try to eat more fruits and vegetables ","2","5","2","5","Chinese tacos or pasta ","2","3","4","940","345","5","2","1315"
"120","1","610","3","420","2","2","My diet is mostly whatever I get to eat in the grotto commons. Sometimes, I eat outside","2","1","Started eating a lot of protein rich food that i didnt before.","2","5","2","5","Chicken, Rice, Vegetables","2","1","3","1165","690","5","2","1315"
"121","1","610","4","420","2","3","My diet consists mainly of coffee, water, fruits, vegetables, and chicken. I tend to stay away from bread and pasta as much as possible. ","2","2","I have noticed there is less time for a prepared meal, so quick and easy has become the norm.","1","3","2","5","pasta, fish, steak","5","1","4","940","500","5","1","1315"
"122","1","265","2","315","2","3","A college student with an imbalanced diet trying to be healthy.","2","1","Eating Pizza as an excuse when there is nothing else to it.","1","3","4","4","Fried Rice _x000D_Baked potatoes _x000D_Curry Chicken","3","3","4","940","500","5","2","1315"
"123","1","720","4","420","1","3","Rice, oatmeal, and tea","2","1","less rice","1","3","3","4","meat, rice, kimchi","3","2","4","580","690","4","2","1315"
"124","1","720","4","420","1","3","I try to eat as healthy as possible everyday.  I have fruit, yogurt and a protein shake everyday.  The other foods i eat vary on a day to day basis.","1","2","I don't eat as much on a daily basis since coming to college.","1","8","5","5","Pizza, Spaghetti, Baked Ziti","4","2","3","940","500","3","1","1315"
"125","1","430","2","315","2","1","high in protein and low in carbohydrates.","1","1","I have learned to eat more vegetables. ","2","5","1","3","Vegetables, Meat, and rice.","5","3","3","725","345","4","2","575"
